{
  "schemaVersion": 1,
  "locale": "zh-Hans",
  "name": "Simplified Chinese",
  "nativeName": "简体中文",
  "strings": {
    "About.DocumentMissing": "未在应用程序旁找到本地法律文档“{0}”。",
    "About.LicenseSummary": "本程序是自由软件：您可以按照自由软件基金会发布的 GNU 通用公共许可证第 3 版或（由您选择）任何更高版本的条款重新分发和/或修改本程序。",
    "About.ModificationNotice": "AuthenticatorDesk 包含由 AuthenticatorDesk 贡献者于 2026 年修改的软件，用于提供认证器兼容功能以及与 WinAuth 文件之间的双向迁移。",
    "About.NoWarranty": "本程序不提供任何担保；详情请参阅 GNU 通用公共许可证。",
    "About.NonAffiliation": "AuthenticatorDesk 是独立项目，并非 WinAuth 官方版本，与 WinAuth 或其原作者没有关联，也未获得其认可或背书。",
    "About.OpenFailed": "无法打开请求的项目：{0}",
    "About.ProjectCopyright": "Copyright © 2026 AuthenticatorDesk 贡献者。",
    "About.ThirdPartyNotices": "第三方声明",
    "About.Title": "关于与许可证",
    "About.Tooltip": "关于 AuthenticatorDesk 并查看许可证",
    "About.Version": "版本 {0}",
    "About.ViewLicense": "查看 GNU GPL",
    "About.WinAuthAttribution": "本程序包含并修改了 Colin Mackie 创建的 WinAuth 的部分代码（Copyright © 2010–2017），依据 GNU GPL 第 3 版或更高版本使用。",
    "About.ProjectRepository": "GitHub 仓库",
    "App.AlreadyRunning": "AuthenticatorDesk 已在运行，请从系统托盘打开。",
    "AuthenticatorCard.Error.InvalidSecret": "密钥无效",
    "AuthenticatorCard.GenerateNext": "生成下一个",
    "AuthenticatorCard.Menu.Delete": "删除",
    "AuthenticatorCard.Menu.Edit": "编辑",
    "AuthenticatorCard.Menu.ExportQrOrUri": "导出二维码 / URI",
    "AuthenticatorCard.Menu.MoveDown": "下移",
    "AuthenticatorCard.Menu.MoveUp": "上移",
    "AuthenticatorCard.Menu.ShowRecoveryCode": "查看恢复码",
    "AuthenticatorCard.Menu.ShowSecret": "查看密钥",
    "AuthenticatorCard.Status.AutoRefreshDisabled": "按需显示 · 自动刷新已关闭",
    "AuthenticatorCard.Status.Counter": "计数器 {0}",
    "AuthenticatorCard.Status.RefreshInSeconds": "{0} 秒后刷新",
    "AuthenticatorCard.Tooltip.CopyCode": "复制验证码",
    "AuthenticatorCard.Tooltip.Favorite": "收藏",
    "AuthenticatorCard.Tooltip.More": "更多操作",
    "AuthenticatorCard.Tooltip.ShowCode": "显示验证码",
    "Clipboard.Copied": "已复制到剪贴板。",
    "Clipboard.Unavailable": "剪贴板暂时不可用。",
    "Common.Add": "添加",
    "Common.Cancel": "取消",
    "Common.Confirm": "确认",
    "Common.Continue": "继续",
    "Common.Copy": "复制",
    "Common.Delete": "删除",
    "Common.Done": "完成",
    "Common.Export": "导出",
    "Common.Hide": "隐藏",
    "Common.Import": "导入",
    "Common.Minutes": "分钟",
    "Common.Open": "打开",
    "Common.Save": "保存",
    "Common.Seconds": "秒",
    "Common.Select": "选择",
    "Common.SelectPlaceholder": "请选择",
    "Common.Settings": "设置",
    "Common.Show": "显示",
    "Common.Unlock": "解锁",
    "Common.Verify": "验证",
    "Dashboard.AccountSummary": "{0} 个账户 · 本地加密保存 · 离线生成",
    "Dashboard.AddAuthenticator": "添加验证器",
    "Dashboard.Empty.AddFirst": "添加第一个验证器",
    "Dashboard.Empty.Description": "添加密钥、扫描二维码，或直接迁移 WinAuth 配置。",
    "Dashboard.Empty.Title": "还没有验证器",
    "Dashboard.Eyebrow": "安全验证码保险库",
    "Dashboard.Filter.All": "全部",
    "Dashboard.Filter.CounterBased": "计数器",
    "Dashboard.Filter.Favorites": "收藏",
    "Dashboard.Filter.TimeBased": "动态",
    "Dashboard.GetStarted": "从添加密钥或迁移 WinAuth 配置开始",
    "Dashboard.HideAllCodes": "全部隐藏",
    "Dashboard.NoMatches.Description": "尝试修改搜索内容或切换筛选条件。",
    "Dashboard.NoMatches.Title": "没有匹配的验证器",
    "Dashboard.ResultCount": "{0} 个验证器",
    "Dashboard.SearchPlaceholder": "搜索名称、服务或备注",
    "Dashboard.ShowAllCodes": "全部显示",
    "Dashboard.Title": "你的动态验证码",
    "DataDirectory.AlreadyInUse": "已经在使用该数据目录。",
    "DataDirectory.Change.Confirmation": "保险库将复制到：\r\n{0}\r\n\r\n切换成功后继续使用新目录，原目录中的旧副本会保留供恢复。{1}",
    "DataDirectory.Change.CopyAndSwitch": "复制并切换",
    "DataDirectory.Change.PasswordNotice": "\r\n\r\n当前使用主密码保护；复制到其他电脑后需要输入同一主密码。",
    "DataDirectory.Change.Title": "更改数据目录",
    "DataDirectory.Change.WindowsProtectionNotice": "\r\n\r\n当前启用了 Windows 账户保护；复制到其他电脑前请先关闭，否则目标电脑无法解锁。",
    "DataDirectory.Choose.Description": "选择 AuthenticatorDesk 数据目录。当前保险库会复制到新目录，原文件保留。",
    "DataDirectory.Location.Custom": "（自定义目录）",
    "DataDirectory.Location.Legacy": "（旧版兼容目录）",
    "DataDirectory.Location.Program": "（程序目录）",
    "DataDirectory.UseExisting.Confirmation": "目标目录已经存在 vault.json：\r\n{0}\r\n\r\n不会覆盖其中的数据。验证成功后应用将重启并打开该保险库，当前目录中的数据仍会保留。",
    "DataDirectory.UseExisting.PasswordPrompt": "输入目标保险库的主密码。切换并重启后还需再次输入。",
    "DataDirectory.UseExisting.Title": "使用已有保险库",
    "DataDirectory.UseExisting.Verified": "目标保险库验证成功，正在重启应用。",
    "DataDirectory.UseExisting.VerifyAndSwitch": "验证并切换",
    "DataDirectory.UseExisting.VerifyTitle": "验证已有保险库",
    "Diagnostics.Context.StartupFailure": "应用启动失败",
    "Diagnostics.Context.UiThreadException": "界面线程异常",
    "Diagnostics.Context.UnhandledException": "未处理异常",
    "Diagnostics.Context.VaultReadFailure": "保险库读取失败",
    "Entry.Delete.Confirmation": "确定删除“{0}”吗？删除后只能通过备份或原始密钥恢复。",
    "Entry.Delete.Title": "删除验证器",
    "EntryEditor.Accessibility.VerificationResult": "认证器验证结果",
    "EntryEditor.Color.Blue": "蓝色",
    "EntryEditor.Color.Cyan": "青色",
    "EntryEditor.Color.Green": "绿色",
    "EntryEditor.Color.Indigo": "靛青",
    "EntryEditor.Color.Orange": "橙色",
    "EntryEditor.Color.Purple": "紫色",
    "EntryEditor.Color.Rose": "玫红",
    "EntryEditor.Field.AccentColor": "强调色",
    "EntryEditor.Field.AccountName": "账户名称",
    "EntryEditor.Field.Algorithm": "算法",
    "EntryEditor.Field.DeviceId": "设备 ID",
    "EntryEditor.Field.Digits": "验证码位数",
    "EntryEditor.Field.GlobalHotkey": "全局快捷键",
    "EntryEditor.Field.HotkeyAction": "快捷键动作",
    "EntryEditor.Field.HotpCounter": "HOTP 计数器",
    "EntryEditor.Field.Issuer": "发行方",
    "EntryEditor.Field.Kind": "认证器类型",
    "EntryEditor.Field.Notes": "备注",
    "EntryEditor.Field.RefreshPeriodSeconds": "刷新周期（秒）",
    "EntryEditor.Field.Serial": "序列号",
    "EntryEditor.Field.SharedSecret": "共享密钥",
    "EntryEditor.Field.SteamData": "Steam 数据",
    "EntryEditor.HotkeyAction.CopyCode": "复制验证码",
    "EntryEditor.HotkeyAction.ShowNotification": "显示系统通知",
    "EntryEditor.HotkeyAction.TypeCode": "自动输入验证码",
    "EntryEditor.Import.Error.EmptyClipboard": "剪贴板中没有可识别的密钥、URI 或二维码。",
    "EntryEditor.Import.Error.InvalidContent": "内容不是有效的 Base32 密钥或 otpauth URI。",
    "EntryEditor.Import.FileDialog.Filter": "图片文件|*.png;*.jpg;*.jpeg;*.bmp;*.gif|所有文件|*.*",
    "EntryEditor.Import.FileDialog.Title": "选择包含认证器二维码的图片",
    "EntryEditor.Import.FromClipboard": "从剪贴板识别",
    "EntryEditor.Import.FromQrImage": "读取二维码图片",
    "EntryEditor.Import.Notification.ParametersLoaded": "已从 URI / 二维码载入认证器参数。",
    "EntryEditor.Import.Notification.SecretLoaded": "已载入共享密钥。",
    "EntryEditor.Import.Warning.MultipleAccounts": "二维码中包含 {0} 个账户；此编辑器已载入第一个。批量导入请使用主页的“导入”。",
    "EntryEditor.Kind.GenericTotp": "通用 TOTP",
    "EntryEditor.Kind.HotpCounter": "HOTP（计数器）",
    "EntryEditor.Option.AutoRefresh": "自动刷新",
    "EntryEditor.Option.CopyOnReveal": "显示后自动复制",
    "EntryEditor.Option.Favorite": "收藏",
    "EntryEditor.Option.RequireUnlock": "每次显示前确认",
    "EntryEditor.Placeholder.DeviceId": "可选，Steam / Trion 迁移信息",
    "EntryEditor.Placeholder.Hotkey": "点击后按下组合键，例如 Ctrl+Alt+G",
    "EntryEditor.Placeholder.Issuer": "服务商或网站名称",
    "EntryEditor.Placeholder.Name": "例如：工作邮箱",
    "EntryEditor.Placeholder.Notes": "仅本机可见的备注",
    "EntryEditor.Placeholder.Secret": "Base32 密钥或 otpauth:// URI",
    "EntryEditor.Placeholder.Serial": "可选，迁移恢复信息时使用",
    "EntryEditor.Placeholder.SteamData": "可选，Steam Guard JSON 数据",
    "EntryEditor.Section.Basic": "基本信息",
    "EntryEditor.Section.BasicDescription": "支持 RFC 4226 / RFC 6238 及常见服务商格式",
    "EntryEditor.Section.OtpParameters": "验证码参数",
    "EntryEditor.Section.OtpParametersDescription": "导入 URI 时会自动识别这些参数",
    "EntryEditor.Section.Preferences": "使用偏好",
    "EntryEditor.Section.PreferencesDescription": "快捷键可在应用最小化时直接复制或输入验证码",
    "EntryEditor.Section.ProviderData": "服务商数据",
    "EntryEditor.Section.ProviderDataDescription": "用于恢复码和 WinAuth 无缝迁移；没有时可以留空",
    "EntryEditor.Section.Verification": "验证认证器",
    "EntryEditor.Section.VerificationDescription": "本地生成当前验证码；请与服务页面显示的结果人工核对",
    "EntryEditor.Subtitle": "密钥只会保存在本机加密保险库中",
    "EntryEditor.Title.Add": "添加认证器",
    "EntryEditor.Title.Edit": "编辑认证器",
    "EntryEditor.Validation.Minimum": "{0}不能小于 {1}。",
    "EntryEditor.Validation.Range": "{0}必须在 {1} 到 {2} 之间。",
    "EntryEditor.Verification.CounterValid": "密钥和参数有效 · 计数器 {0}（预览不会推进计数器）",
    "EntryEditor.Verification.Failed": "验证失败",
    "EntryEditor.Verification.Instructions": "输入密钥并确认参数后，生成当前验证码与服务页面核对。",
    "EntryEditor.Verification.ParametersChanged": "参数已更改",
    "EntryEditor.Verification.ParametersChangedDescription": "旧验证码已隐藏，请使用当前密钥和参数重新验证。",
    "EntryEditor.Verification.Retry": "重新验证",
    "EntryEditor.Verification.TimeBasedValid": "密钥和参数有效 · {0} 秒后刷新 · 请与服务页面核对",
    "EntryEditor.Verification.Verify": "验证并生成验证码",
    "EntryEditor.Verification.Waiting": "等待验证",
    "Error.Code.GenerationFailed": "无法生成验证码：{0}",
    "Error.DataDirectory.ChangeFailed": "无法切换数据目录：{0}",
    "Error.DataDirectory.ChangeFailedWithCopy": "无法切换数据目录：{0}\r\n目标可能保留了可读取的副本：{1}",
    "Error.DataDirectory.InvalidPath": "目录路径无效：{0}",
    "Error.DataDirectory.OpenFailed": "无法打开数据目录：{0}",
    "Error.DataDirectory.UseExistingFailed": "无法使用目标保险库：{0}",
    "Error.Export.BackupFailed": "备份失败：{0}",
    "Error.Export.OtpUrisFailed": "导出 OTP Auth URI 失败：{0}",
    "Error.Export.WinAuthFailed": "导出 WinAuth 配置失败：{0}",
    "Error.Hotkey.MultipleRegistrationFailed": "{0} 个全局快捷键注册失败，请在条目设置中检查。",
    "Error.Hotkey.RegistrationFailed": "{0} 注册失败：{1}",
    "Error.Import.Failed": "导入失败：{0}",
    "Error.Import.QrFailed": "无法导入二维码：{0}",
    "Error.Import.UriFailed": "URI 无法解析：{0}",
    "Error.Import.WinAuthYubiKey": "此 WinAuth 配置使用 YubiKey 保护。请先在原 WinAuth 中解锁，并导出为密码保护或明文 XML 后再迁移。",
    "Error.RecoveryCode.MissingData": "当前 Battle.net 条目缺少生成恢复码所需的信息。",
    "Error.Restart.ExecutablePathUnknown": "无法确定当前程序路径。",
    "Error.Startup.UpdateFailed": "无法更新开机启动：{0}",
    "Error.UnknownUnhandled": "发生了未知的未处理异常。",
    "Error.Vault.LockCancelledUnsaved": "保险库尚未成功保存，已取消锁定以避免丢失更改。",
    "Error.Vault.PasswordUpdateFailed": "无法更新主密码：{0}",